dignity;negative;commentОтличная картинка  показывает несравнимо лучше многих моделей с таким же разрешением  просто огонь  Пульт красивый  телек красивый и лёгкий   Читает внешние жёсткие диски без проблем;Звучит ужасно  никаких нижних  все звучит как камрип  3 5 нет  Система очень глупая  Китайская версия   это для тех  кому гемор по приколу  Гугл сервисов нет   ютуб заводится с бубном  гугл маркета нет  приложения из сети  заработают не все  Далеко не все   Есть приложение  искать в сети   митв ассистент  с ним можно устанавливать апк с телефона  Оно поможет сделать хоть что то   Переключить систему с китайского   по урокам из сети  спасибо  что они есть   В России как телек работать не будет  но для меня это не важно  Айпитв работает и хватит;Только для тех  кто разобраться сможет  И хочет разобраться   У других производителей есть тв с такими же характеристиками  на 1500 дороже  С 3 5 джеком и норм системой   Моим косяком было взять этот телек  мне с ним жить   Отзыв актуален для китайской версии
Отличный дизайн  картинка  угол обзора  функционал  Немного хромает звук  но это лечится добавлением саундбара того же изготовителя;Не обнаружено;Отличный аппарат  В гостиную возьму того же изготовителя  только изогнутый и побольше
Довольно компактный  Великолепное качество за отличную цену   Классный пуль  удобно управляется  Отличное качество распознавания речи;Звук не очень  но зачем звук в телевизоре для кухни   да и  в принципе  все;Отличный вариант для кухни  как в моем случае   туалета  ванной
Андроид;Для меня за эту цену    нет;Смотрю спутниковое через ресивер  качеством картинки и звука доволен  Не думаю что дождусь Xiaomi с тюнерами DVB S S2
Хорошая цена за монитор с АндроидТВ  Качество картинки соответствует заявленному  Легкий;1  Никакущий приемник эфирного и кабельного сигнала  Там  где приставка берет два эфирных мультиплекса  и кучу каналов кабельного ТВ  DVB C   телевизор не справился вообще   2  Возрастная категория лиц ограничена   людям очень старшего поколения данный аппарат противопоказан категорически   3  АндродТВ против обычного Андроида может заставить вас купить приложения  которые вы уже приобретали  но для обычной платформы Андроид  для приставок  например;Это не ТВ  так как радиочасть для приема цифрового сигнала на антенный вход отвратительная  Это все таки монитор с WiFi и андроидом  эдакий настенный планшет
Современный телевизор по цене смартфона;Не обнаружила;В данной ценовой категории конкурентов нет  Честно не понимаю как можно искать недостатки в телевизоре с полным фаршем за такую стоимость  Подключили к сети по Wi Fi и смотрим каждый день что захотим  Подарочные подписки активировали не все  поленились разбираться  У своего провайдера подключили доступ к одному из ТВ приложений по низкой цене и не стали покупать антенну  Ну включается не сразу  может секунд 40 грузится  ну и что  Планшеты и смартфоны также себя ведут часто  Безупречность стоит совсем других денег
Цена;не обнаружил;Отличная вещь за свои деньги  Почитав отзывы по поводу звука и изображения  несколько призадумался  но за такие деньги      Вообщем взял в детскую комнату  убьют не жалко   Однако телевизор  или правильнее сказать планшет с пультом  превзошел все ожидания  Звук хороший  если вы не меломан то останетесь довольны  по качеству изображения тоже все вполне достойно  кому не нравится могут купить тв с 4к за 40   т р  и будут счастливы   Много предустановленных программ для просмотра интернет тв   обычное тв в качестве бонуса  Да  полностью русифицирован  тоже немного переживал   5
1  экосистема xiaomi  это довольно удобно                                 2  android  поставил всякого ширпотреба вроде hd videobox и kodi  Можно эмуляторов приставок поставить                                 3  есть блютуз это значит что уши и колонки я могу вешать без проводов                                 4  hdr с ним картинка повеселее                                 5  пульт  он простой  легкий и работает даже на соседнем этаже                                 6  поддерживает air mirroring  я могу не просто использовать miracast  а натурально подключить свой macbook и iphone к телеку                                  7  wi fi 78мбит                                 8  изображение без засветов абсолютно  с черным и большими углами обзора;1  2 hdmi  даже в старом бюджетном самсунге их 4                                 2  китайские надписи и сервисы  перешить пока не получится  Но можно поставить английский и жить с ним                                 3  ножки какие то угрюмые  в остальном дизайн ок                                 4  колонкам не хватает немного мощности  спасают пресеты                                 5  китайская реклама изгоняется блокировкой китайских хостов на роутере                                 6  нет таких крутых уплавлялок как на самсунг или сони  я вообще не уверен  что они есть;Вообщем немного опечален китайцами  но в широком смысле тв доволен  показывает триколор и играется с xbox one s  наверное на дачу куплю еще такой  Дизайн корпуса стремноват  но он не бесит и за такую цену уже не плохо что есть  Сзади алюминий  рамки из добротного пластика  самса вся из пластика  Вообщем очень рекомендую  Даже рядом с 4к 40 смотрится классно  По вопросам легко найти тему на форумах типа 4пда
Android                                 Скорость работы                                 Качество картинки                                 Без проводов;А в жизни всегда так  Либо короткая дорожка через лес с бабой ягой  либо длинная в обход                                  Для лично меня нет                                  Не воспроизводит 4К с youtube  нет поддержки кодека VP9 в который youtube перекодировал свои 4K ролики;Я думал что мне вообще не нужен телевизор пока не столкнулся с этим чудом за вменяемые деньги  Андроид это просто сказка любой функционал можно организовать при желании поковыряться  Он лайн фильмы бесплатные  воспроизведение Торренты прямо он лайн в 4K без скачивания  Телевидение через интернет с огромным количеством каналов без всяких заморочек с плейлистами и тд                                  Но смотрите по модели 4A 43 есть нюансы  по сути под этим индексом продаются совершенно разные телевизоры технически                                  4A 43   дорестайлинг 2гб 8Гб Bluetooth Wifi 2 4 и 5 ггц шикарная матрица LG                                 4A 43   рестайлинг 1 8 Гб нет BT Wifi только 2 4 матрица бюджетного сегмента                                 4A 43 PRO   версия для индийского рынка 1 8ГБ BT есть  wifi 2 4  шикарная матрица LG на вид качество картинки уровня QLED  в этой модели работает голосовой поиск удобная штука и он полностью на русском
1  Отличное качество изображения за свои деньги                                  2  Никаких китайских иероглифов и прошивок                                 3  Все меню на русском языке  поддержка голосового управления на русском                                 4  Поддержка цифрового ТВ без всяких приставок                                 5  Очень хороший и качественный звук  мощные колонки                                 6  Качество изготовления                                 7  Android  доступность сервисов Гугла  в том числе Play Market                                 8  Удобный и простой пульт  проще некуда;Вилка  Она довольно таки странная  Для наших розеток вроде как переходник не нужен  но корпус вилки имеет очень широкие края  штыри на вилке довольно короткие  Поэтому  если розетка утопленная  то переходник все же понадобится;Нашел модель 4A 43 Pro за 25499  Их вроде как делают в Индии и недавно стали поставлять в Россию  Изначально шел забирать обычный 4A 43  который на 3 тыс  дешевле  но в магазине предложили обратить внимание на версию Pro  Включив два телека рядом можно было их сравнить и выбор для меня был очевиден  В первую очередь меня подкупило то  что отпала перспектива мороки с китайскими сервисами  перепрошивками и прикручиванием русского языка  хотя я уже был готов к этому  А тут включил и сразу все на русском без каких либо проблем  Остальные плюсы перечислил выше  Кстати  в этом телеке 3 hdmi
Сразу оговорюсь  у меня индийская  глобальная  телевизора                                   Относительно узкие рамки                                   Нормальная матрица  засветов не вижу  При обзоре сбоку цвета не искажаются  но черный теряется                                   Смарт составляющая не тупит  И вообще это android tv  а не какая нибудь урезанная недоплатформа                                   Пульт  количество кнопок которого можно посчитать по пальцам двух рук даже не слишком удачливого слесаря                                   Пульт связывается по Bluetooth  на пульте есть микрофон и отсюда   возможность голосового управления  Правда пока что практиковался искать только видосы в ютубе                                   Вместо пульта можно юзать смартфон                                   Звук громкий  подстройка тонкая  но подозреваю  что на максимальных значениях громкости может хрипеть  но он реально громкий                                   Приверженцы бренда оценят его вовлеченность в экосистему сяоми                                   Нет тяжелой подставки                                   Порты находятся на задней крышке  но перпендикулярно стене  проблем повесить телик и воткнуть все необходимое не будет                                  3 HDMI  один с обратной связью ARC   3 USB  тюльпан  антенный вход  коаксиальный spdif  lan и для наушников разъем                                  русский язык в комплекте  google play наличествует                                  вес    когда я его получил  я думал  что в коробке ничего нет                                    поддержка DTS HD  Для меня очень важно  поскольку смотрю видео с терабайтника  старый телевизор не умел пропускать через себя объемный звук и декодировал в стерео без шансов  Тут  если грамотно подключите к ресиверу  все будет тип топ;Матрица 60 Гц  хорошая бюджетная матрица  глаза лично у меня от нее не устают   Но можно и сотку было поставить  с меньшим временем отклика                                  Почему нет ни одного USB 3 0                                   я привык к оптическому spdif у  поэтому коаксиальный мне слегка не удобен                                   ОЗУ в два раза меньше  чем в китайках   1 гигабайт  На работе не заметил  что сказывается  К видеоускорителям Mali отношусь довольно скептически из за не очень приятного телефонного прошлого  общего с видеоускорителями этой марки                                   Равномерно горячий сзади  вся задняя крышка   Первые три дня работы может слегка попахивать пластиком  который тоже в общем то неплохой                                   встроенный плеер  никто не мешает поставить сторонний  не читает вшитые субтитры в мкв файлах  где то не проигрывает звук  да и вообще прошивка как будто демоверсия какого нибудь мибокса   минимум функций  аскетизм и все такое  Зато андроид 8                                   динамическую подсветку лучше сразу вырубить  убивает яркость                                  вилка индусская  Сама вилка нормальная  как европейская  но короткая  и корпус широкий  Сие означает  что в евророзетку она не влезет без переходника                                   отсутствие DVB Т и подобных стандартов за недостаток не считаю  никогда ими не пользовался                                  тема на 4пда  к сожалению  на момент написания вам не помощник                                    если вы будущий владелец китайской версии  перепрошить телик на глобалку не получится  а у китайцев в прошивке дофига китайщины  рекламы и фиг нормально русифицируешь;UPDATE  после полугода пользования все так же доволен ТВ  В одной из прошивок WiFi отваливался часто  что не позволяло смотреть комфортно контент по DLNA  лучше подключать проводом  HDVideobox изредка виснет  раза 3 4 в месяц   но скорее всего проблемы не со стороны клиента  Торрент тв не смотрю  но какие то каналы вроде идут без вылетов  Из за небольшого объема ОЗУ критически влияет оптимизация программ  я так удалил VLC и пару других плееров  Сейчас для DLNA стоит Kodi  на запас Vimu Player  видеобокс смотрю через MXPlayer т к  там на лету можно переключать кодеки HW и HW   плюс отдельно всего включен софтварный декодер звука   Короче  нужно немного понастраивать и поэкспериментировать после покупки                                     _____                                 Брал на сервисе под названием бело черного пятнистого мишки за полцены  сам сервис отчаянно не рекомендую   За те деньги недостатки смешные  Да в принципе и за 20к тоже                                  По цене аналогичные либо не FullHD  матрица похуже  50 Гц  мыло  засветы   смарт составляющая не такая уж и смарт  обрубки типа webos или tizen   да и тормозит  Что то адекватное будет от 40000 и выше  смотрим в сторону филипса                                   Цветность у ТВ нормальная  нужно выставить режим  vivid  и убрать динамическую яркость в настройках  Звук выставил в режим  фильм                                   Подключение и настройка телевизора проблем не вызвала  инструкция в комплекте как таковая отсутствует  но оно и не надо  все интуитивно понятно  индусские разработчики обещают допилить прошивку и добавить часть фич                                 Очень рекомендую докинуть до телика кабель с живительным интернетом  иначе в смарт составляющей смысла не будет  Обильное количество портов позволяет воткнуть в один из них удлинитель  чтобы постоянно внешние харды перетыкать   в другие периферию  типа мышки и клавы                                  В целом телевизор получился настолько же успешно  как серия Redmi Note у их смартфонов  На некоторых вещах сэкономили  но максимум из цены выжали и оставили конкурентов позади
Множество  от внешнего вида  до качества изображения и цены;Прошивка нужна или TV BOX  Бывают и русские версии  которые изначально на Русском языке  но эта тоже нормальная если посидеть пару часов на форуме;В целом модель отличная  Но нехватает встроеного русского языка с нашими сервисами
Современный тонкий легкий  Хорошо воспроизводит видео с ютюба  Воспроизводит тв каналы тоже не плохо вроде  Хотя более старый телек самсунг на кухне воспроизводит тв каналы лучше;С танцами с бубном можно подключить колонки через блютюз я подключил колонку  Качество звука при этом отвратительное из за перебоев на любой громкости  Блютуз наушники вообще ни разу не законектились при том что телевизор их видит  После отключения блютуз колонки при просмотре тв каналов и ютюба проблемы со звуком от встроенных динамиков также возникали  Не работает с приложением умный дом сяоми  Купил телек исключительно из за этой перспективы подключится к системе умный дом  Ощущение  что меню настроек делали депутаты не поддается какому либо здравому смыслу;Сильно разочарован  если не сказать больше
телик конечно же огонь но если нет поддержки русского то в рф он не нужен;китайщина полная;хорошо но не для россии
Картинка четкая  операционка шустрая;Звук слабый  иногда подвисает;Вообщем за эту цену  придирки излишне
